{
  "schema_version": "1.0",
  "metadata_version": "1.0",
  "source_of_truth": false,
  "generated_from": "harness/schemas/, harness/harness.yaml, harness/stages.yaml, harness/suites/, harness/pipeline/ingest.yaml, ci/, .claude/, .github/, project.yaml, pyproject.toml (lista completa e verificável em provenance.inputs)",
  "vocabulary": [
    {
      "field": "assertion.kind",
      "pointer": "/$defs/assertion/allOf/0/if/properties/kind",
      "file": "adr-index.schema.json",
      "group": "arquitetura",
      "values": [
        "path_absent",
        "path_present"
      ]
    },
    {
      "field": "assertion.kind",
      "pointer": "/$defs/assertion/allOf/1/if/properties/kind",
      "file": "adr-index.schema.json",
      "group": "arquitetura",
      "values": [
        "import_required",
        "import_forbidden"
      ]
    },
    {
      "field": "assertion.kind",
      "pointer": "/$defs/assertion/allOf/2/if/properties/kind",
      "file": "adr-index.schema.json",
      "group": "arquitetura",
      "values": [
        "file_matches",
        "file_lacks"
      ]
    },
    {
      "field": "assertion.kind",
      "pointer": "/$defs/assertion/properties/kind",
      "file": "adr-index.schema.json",
      "group": "arquitetura",
      "values": [
        "path_absent",
        "path_present",
        "dir_allowlist",
        "import_required",
        "import_forbidden",
        "file_matches",
        "file_lacks",
        "schema_lock",
        "manual"
      ]
    },
    {
      "field": "assertion.match",
      "pointer": "/$defs/assertion/properties/match",
      "file": "adr-index.schema.json",
      "group": "arquitetura",
      "values": [
        "all",
        "any"
      ]
    },
    {
      "field": "assertion.mutation.op",
      "pointer": "/$defs/assertion/properties/mutation/properties/op",
      "file": "adr-index.schema.json",
      "group": "arquitetura",
      "values": [
        "remover_caminho",
        "criar_caminho",
        "apagar_padrao",
        "apagar_linha",
        "injetar_texto",
        "injetar_apos",
        "quebrar_ponteiro",
        "substituir_texto"
      ]
    },
    {
      "field": "assertion.severity",
      "pointer": "/$defs/assertion/properties/severity",
      "file": "adr-index.schema.json",
      "group": "arquitetura",
      "values": [
        "low",
        "medium",
        "high",
        "critical"
      ]
    },
    {
      "field": "adrs.status",
      "pointer": "/properties/adrs/items/properties/status",
      "file": "adr-index.schema.json",
      "group": "arquitetura",
      "values": [
        "proposed",
        "accepted",
        "superseded",
        "deprecated"
      ]
    },
    {
      "field": "assurance_lock.situations.expected",
      "pointer": "/properties/assurance_lock/properties/situations/items/properties/expected",
      "file": "assurance-lock.schema.json",
      "group": "governança",
      "values": [
        "blocked",
        "accepted_in_fixture_only",
        "not_assessed",
        "not_satisfied",
        "release_eligible_false"
      ]
    },
    {
      "field": "assurance_lock.situations.scope",
      "pointer": "/properties/assurance_lock/properties/situations/items/properties/scope",
      "file": "assurance-lock.schema.json",
      "group": "governança",
      "values": [
        "strict_ci",
        "production",
        "fixture_preparation"
      ]
    },
    {
      "field": "findings.origin",
      "pointer": "/properties/findings/items/properties/origin",
      "file": "audit-report.schema.json",
      "group": "governança",
      "values": [
        "adr_assertion",
        "adr_meta",
        "assertion_self_match",
        "stage_coverage",
        "stage_partition",
        "policy_pointer",
        "risk_control",
        "protected_path",
        "lgpd_inventory",
        "lgpd_scan",
        "lgpd_retention",
        "lgpd_declaration",
        "lgpd_judgment",
        "manual_assertion",
        "ingest_pipeline",
        "alignment_risk",
        "alignment_orphan",
        "conformance_review",
        "cp_lifecycle",
        "decision_chain",
        "change_buffer",
        "external_audit",
        "ledger",
        "agent_pairing",
        "dependency_conflict",
        "suite_contract",
        "cadence_single_source",
        "approval_gate"
      ]
    },
    {
      "field": "findings.pbd_principle",
      "pointer": "/properties/findings/items/properties/pbd_principle",
      "file": "audit-report.schema.json",
      "group": "governança",
      "values": [
        "Proativo e Preventivo",
        "Privacy by Default",
        "Privacidade no Design",
        "Soma Positiva",
        "Transparência",
        "Segurança Ponta-a-Ponta",
        "Centrado no Usuário"
      ]
    },
    {
      "field": "findings.severity",
      "pointer": "/properties/findings/items/properties/severity",
      "file": "audit-report.schema.json",
      "group": "governança",
      "values": [
        "info",
        "low",
        "medium",
        "high",
        "critical"
      ]
    },
    {
      "field": "provenance.auditor",
      "pointer": "/properties/provenance/properties/auditor",
      "file": "audit-report.schema.json",
      "group": "governança",
      "values": [
        "ci/audit_governance.py",
        "ci/audit_lgpd.py",
        "ci/alignment_report.py",
        "ci/audit_conformance.py",
        "ci/audit_ledger.py",
        "ci/check_dependency_conflict.py",
        "ci/audit_suites.py"
      ]
    },
    {
      "field": "result",
      "pointer": "/properties/result",
      "file": "audit-report.schema.json",
      "group": "governança",
      "values": [
        "ok",
        "findings",
        "error"
      ],
      "note": "ok = o real corresponde ao declarado; findings = há divergência; error = o fiscal não conseguiu fiscalizar."
    },
    {
      "field": "items.priority",
      "pointer": "/properties/items/items/properties/priority",
      "file": "backlog.schema.json",
      "group": "negócio",
      "values": [
        "low",
        "medium",
        "high",
        "critical"
      ]
    },
    {
      "field": "items.status",
      "pointer": "/properties/items/items/properties/status",
      "file": "backlog.schema.json",
      "group": "negócio",
      "values": [
        "proposed",
        "planned",
        "in_progress",
        "done",
        "dropped"
      ]
    },
    {
      "field": "items.type",
      "pointer": "/properties/items/items/properties/type",
      "file": "backlog.schema.json",
      "group": "negócio",
      "values": [
        "user-story",
        "task",
        "bug",
        "enabler"
      ]
    },
    {
      "field": "etapas.drift.estado",
      "pointer": "/properties/etapas/properties/drift/properties/estado",
      "file": "bootstrap-report.schema.json",
      "group": "etapas",
      "values": [
        "em-dia",
        "atrasado",
        "indisponivel"
      ]
    },
    {
      "field": "etapas.workspace.acao",
      "pointer": "/properties/etapas/properties/workspace/properties/acao",
      "file": "bootstrap-report.schema.json",
      "group": "etapas",
      "values": [
        "materializado",
        "avancado",
        "ja-no-sha",
        "nao-aplicavel"
      ]
    },
    {
      "field": "kind",
      "pointer": "/properties/kind",
      "file": "bootstrap-report.schema.json",
      "group": "etapas",
      "values": [
        "mold",
        "derived"
      ]
    },
    {
      "field": "resultado",
      "pointer": "/properties/resultado",
      "file": "bootstrap-report.schema.json",
      "group": "etapas",
      "values": [
        "ok",
        "divergencias",
        "fiscal-nao-fiscalizou",
        "erro"
      ]
    },
    {
      "field": "rules.status",
      "pointer": "/properties/rules/items/properties/status",
      "file": "business-rules.schema.json",
      "group": "negócio",
      "values": [
        "proposed",
        "planned",
        "implemented",
        "verified",
        "deprecated"
      ]
    },
    {
      "field": "capabilities.risk_level",
      "pointer": "/properties/capabilities/items/properties/risk_level",
      "file": "capabilities.schema.json",
      "group": "negócio",
      "values": [
        "low",
        "medium",
        "high",
        "critical",
        "pending_judgment"
      ],
      "note": "Nível de risco da capacidade. pending_judgment é o valor que a INGESTÃO escreve por não poder decidir: reprovado por check_pending_judgment em qualquer documento com source_of_truth:true, logo só sobrevive enquanto o documento se declara derivado. Promover é substituí-lo."
    },
    {
      "field": "capabilities.status",
      "pointer": "/properties/capabilities/items/properties/status",
      "file": "capabilities.schema.json",
      "group": "negócio",
      "values": [
        "proposed",
        "planned",
        "implemented",
        "verified",
        "deprecated"
      ],
      "note": "Maturidade. O fiscal semântico só exige código+teste existentes para implemented/verified."
    },
    {
      "field": "proposal.risk_assessment.level",
      "pointer": "/allOf/0/if/properties/proposal/properties/risk_assessment/properties/level",
      "file": "change-proposal.schema.json",
      "group": "mutação",
      "values": [
        "high",
        "critical"
      ]
    },
    {
      "field": "proposal.risk_assessment.level",
      "pointer": "/allOf/3/if/properties/proposal/properties/risk_assessment/properties/level",
      "file": "change-proposal.schema.json",
      "group": "mutação",
      "values": [
        "high",
        "critical"
      ]
    },
    {
      "field": "proposal.author_kind",
      "pointer": "/properties/proposal/properties/author_kind",
      "file": "change-proposal.schema.json",
      "group": "mutação",
      "values": [
        "agent",
        "human",
        "ci"
      ]
    },
    {